{
  "$schema": "https://json-schema.org/draft/2020-12/schema",
  "$id": "https://schemas.pattertech.eos/capability-profile.schema.json",
  "title": "EOS capability profile",
  "description": "Evidence-earned, versioned and expiring authority record. Profile level tunes Express thresholds, the free decision band and review sampling; it never affects tier floors or non-waivable floors. No code loads this record and no check reads it: the required authorised_by entry is what a reviewer holds a promotion to, not a gate a checker enforces. The tuning is a person reading the record and editing the policy.",
  "type": "object",
  "additionalProperties": false,
  "required": [
    "version",
    "level",
    "evidence",
    "authorised_by",
    "authorised_date",
    "expires",
    "regression_rule"
  ],
  "properties": {
    "version": {
      "type": "integer",
      "minimum": 1
    },
    "level": {
      "type": "string",
      "enum": ["conservative", "standard", "frontier"]
    },
    "evidence": {
      "type": "object",
      "additionalProperties": false,
      "required": ["benchmark_runs", "sampled_review", "escaped_defects", "period"],
      "properties": {
        "benchmark_runs": {
          "type": "array",
          "items": { "type": "string" },
          "description": "run_id values from the benchmark ledger (benchmark-result.schema.json)."
        },
        "sampled_review": {
          "type": "object",
          "additionalProperties": false,
          "required": ["n", "pass_rate"],
          "properties": {
            "n": { "type": "integer", "minimum": 0 },
            "pass_rate": {
              "type": ["number", "null"],
              "minimum": 0,
              "maximum": 1,
              "description": "Null when no sampled review has run. A rate of 1.0 against an n of 0 reads as a perfect record and makes regression_rule.thresholds.sampled_review_pass_rate_min unable to fire; null says the threshold is not evaluable, which is the true statement."
            },
            "note": {
              "type": "string",
              "minLength": 1,
              "description": "Why the numbers are what they are, for a reader who would otherwise take a null or a zero at face value."
            }
          }
        },
        "escaped_defects": {
          "type": "integer",
          "minimum": 0
        },
        "period": {
          "type": "string",
          "minLength": 1,
          "description": "The window the evidence covers, for example 2026-02/2026-08."
        }
      }
    },
    "authorised_by": {
      "type": "string",
      "minLength": 1,
      "description": "The operator. Promotion needs new evidence plus separate operator authorisation."
    },
    "authorised_date": {
      "type": "string",
      "pattern": "^\\d{4}-\\d{2}-\\d{2}$"
    },
    "authorisation_note": {
      "type": "string",
      "minLength": 1,
      "description": "Anything about this authorisation a reader needs and the fields cannot carry: what was back-filled, what ordering the dates hide, what the level is due to be re-argued against. Re-dating a record to make it look tidy loses the fact; a note keeps it."
    },
    "expires": {
      "type": "string",
      "pattern": "^\\d{4}-\\d{2}-\\d{2}$",
      "description": "Default six months after authorisation. An expired profile falls back to conservative."
    },
    "regression_rule": {
      "type": "object",
      "additionalProperties": false,
      "required": ["thresholds"],
      "properties": {
        "thresholds": {
          "type": "object",
          "additionalProperties": false,
          "required": ["sampled_review_pass_rate_min", "escaped_defects_max"],
          "properties": {
            "sampled_review_pass_rate_min": {
              "type": "number",
              "minimum": 0,
              "maximum": 1
            },
            "escaped_defects_max": {
              "type": "integer",
              "minimum": 0
            }
          }
        },
        "on_breach": {
          "const": "regress-one-level",
          "description": "Crossing a threshold regresses the profile one level automatically, logged."
        },
        "evaluable": {
          "type": "boolean",
          "description": "False when at least one threshold has nothing to test against, so the rule cannot fire on it. A rule recorded as live while half of it is untestable reads as protection that is not there."
        },
        "not_evaluable_reason": {
          "type": "string",
          "minLength": 1,
          "description": "Which threshold cannot be evaluated and why, and what the rule still fires on meanwhile."
        }
      }
    }
  }
}
